{
  "version": 1,
  "operation": "distinction-collision",
  "name": "Finite approval domain without collision",
  "source": {
    "schema": "../schemas/approval-source.schema.json",
    "enumerator": {
      "argv": [
        "node",
        "../generators/enumerate_approval_no_collision.js"
      ],
      "timeoutMs": 2000
    },
    "equivalence": {
      "mode": "exact"
    }
  },
  "forward": {
    "argv": [
      "node",
      "../transforms/approval_up.js"
    ],
    "timeoutMs": 2000
  },
  "target": {
    "schema": "../schemas/approval-target.schema.json",
    "equivalence": {
      "mode": "exact"
    }
  },
  "search": {
    "mode": "exhaustive",
    "budget": 10000,
    "seed": 918273
  },
  "replay": {
    "forward": 1,
    "equivalence": 1
  }
}
