{
  "version": 1,
  "operation": "domain-exclusion",
  "name": "Noisy pending review exclusion",
  "source": {
    "schema": "../schemas/noisy-status-source.schema.json",
    "corpus": [
      "../corpus/status_noisy_pending_review.json"
    ],
    "equivalence": {
      "mode": "exact"
    }
  },
  "forward": {
    "argv": [
      "node",
      "../transforms/status_up_reject_pending.js"
    ],
    "timeoutMs": 2000
  },
  "target": {
    "schema": "../schemas/status-target.schema.json",
    "equivalence": {
      "mode": "exact"
    }
  },
  "search": {
    "mode": "corpus",
    "budget": 100,
    "seed": 918273
  },
  "shrink": {
    "enabled": true,
    "budget": 200,
    "preserveClassification": true
  },
  "replay": {
    "forward": 1,
    "equivalence": 1
  }
}
