{
  "version": 1,
  "operation": "domain-exclusion",
  "name": "Approval mutation candidates all cross",
  "source": {
    "schema": "../schemas/approval-source.schema.json",
    "corpus": [
      "../corpus/approval_manual.json"
    ],
    "equivalence": {
      "mode": "exact"
    }
  },
  "forward": {
    "argv": [
      "node",
      "../transforms/approval_up.js"
    ],
    "timeoutMs": 2000
  },
  "target": {
    "schema": "../schemas/approval-target.schema.json",
    "equivalence": {
      "mode": "exact"
    }
  },
  "search": {
    "mode": "corpus-mutation",
    "budget": 100,
    "seed": 918273
  },
  "replay": {
    "forward": 1
  }
}
