{
  "version": 1,
  "operation": "domain-exclusion",
  "name": "Pending review status is rejected by migration",
  "source": {
    "schema": "../schemas/status-source.schema.json",
    "corpus": [
      "../corpus/status_active.json",
      "../corpus/status_pending_review.json"
    ],
    "equivalence": {
      "mode": "exact"
    }
  },
  "forward": {
    "argv": [
      "node",
      "../transforms/status_up_reject_pending.js"
    ],
    "timeoutMs": 2000
  },
  "target": {
    "schema": "../schemas/status-target.schema.json",
    "equivalence": {
      "mode": "exact"
    }
  },
  "search": {
    "mode": "corpus",
    "budget": 1000,
    "seed": 918273
  },
  "shrink": {
    "enabled": true,
    "budget": 5000,
    "preserveClassification": true
  },
  "replay": {
    "forward": 3
  }
}
